{
  "$schema": "https://json-schema.org/draft/2020-12/schema",
  "$id": "https://watchmyai.example/schema/policy-bundle-1.2.json",
  "title": "WatchMyAI Organization Policy Bundle 1.2",
  "type": "object",
  "additionalProperties": false,
  "required": ["schema_version", "policy_bundle_id", "policy_bundle_version", "policy_sequence", "organization_id", "mode", "policies"],
  "properties": {
    "schema_version": {"const": "1.2"},
    "policy_bundle_id": {"type": "string", "minLength": 1},
    "policy_bundle_version": {"type": "string", "minLength": 1},
    "policy_sequence": {"type": "integer", "minimum": 1},
    "organization_id": {"type": "string", "minLength": 1},
    "mode": {"enum": ["observe", "monitor", "restrict", "strict"]},
    "default_effect": {"enum": ["ALLOW", "DENY", "REQUIRE_APPROVAL", "MONITOR"]},
    "required_capabilities": {"type": "array", "items": {"type": "string"}, "uniqueItems": true},
    "metadata": {"type": "object"},
    "policies": {
      "type": "array",
      "items": {
        "type": "object",
        "additionalProperties": false,
        "required": ["policy_id", "policy_version", "effect", "match"],
        "properties": {
          "policy_id": {"type": "string", "minLength": 1},
          "policy_version": {"type": "string", "minLength": 1},
          "priority": {"type": "integer"},
          "effect": {"enum": ["ALLOW", "DENY", "REQUIRE_APPROVAL", "MONITOR"]},
          "match": {"type": "object", "minProperties": 1},
          "obligations": {"type": "array", "uniqueItems": true, "items": {"enum": ["AUDIT_FULL", "AUDIT_METADATA_ONLY", "REDACT_ARGUMENTS", "REDACT_RESULT", "CAPTURE_ARGUMENT_HASH", "REQUIRE_EXECUTION_RECEIPT", "REQUIRE_APPROVAL_RECEIPT", "REQUIRE_JUSTIFICATION", "TERMINATE_SESSION_ON_FAILURE", "EMIT_HIGH_SEVERITY_ALERT", "NOTIFY_SECURITY"]}},
          "reason_code": {"type": "string", "minLength": 1},
          "description": {"type": "string"}
        }
      }
    }
  }
}
